,vacancies,post_time,p_year_month,interview_time,content,成就感,學習成長,創新,薪資,福利,管理制度,工作氛圍,同事互動,主管風格,工作地點,公司規模,工作環境,產業前景,輪調,外派,出差,引擎,馬力,避震,外觀,操控,安全,堅固,配備,價錢,科技,品質,折舊,品牌,空間,保養,續航,尺寸,車種,驅動,變速箱,電資,機械,製造,車輛工程,品管,多元性,企業社會責任,企業永續目標,面試,徵才,實習,工作,離職,轉職,新鮮人,畢業,出路,能力,招募人員,正向,負向
0,職員,2023.03.24,2023-03,2023.03,首先會先做專業能力測驗，大約50分鐘，再來會做英文多益測驗40分鐘，做完後就進行視訊面試，1分鐘有HR做開場，再來就是自我介紹，介紹後主管(2位)會詢問問題，問前面公司的經歷，再來是問如何面對一個完全不知道專案，問完後換另外一位主管詢問，並且說明禮拜六日會有輪班的制度。工作地點如何選擇？希望是以家裡近為優先。建議專業能力的測驗是準備一下(是申論題)，英文測驗的話會以(多益方式進行，如果是視訊面試操作的話，會比較困難，要細心地操作),0,0,0,0,0,2,0,0,2,1,0,0,0,0,0,0,0,218,0,0,0,0,0,0,0,0,0,0,0,0,0,0,0,0,0,0,0,0,0,0,0,0,0,0,5,0,1,1,0,0,0,0,0,6,3,2,218
1,客服,2023.03.24,2023-03,2023.01,覺得很浪費時間，我面試大夜班，到現場要先測試聽力打字，現場很吵，然後反應也沒用，也不知道在測什麼的，感覺是測爽的，然後果然面試官就說要從日班開始，日班薪水也是由一堆薪資結構湊到30k，也就是你要想辦法上到大夜給的38-42k，你可能要在公司待個一年以上吧，然後中間會很多考核，很多複雜的考核方式給錢這部分我就沒記很清楚。沒有問問題？基本上都是在講解工作內容。如果你想考車險，他這邊好像會培訓你考證照大概是這樣，我覺得就是普通的客服，薪水就30k差不多就這樣了，要拿到上面的高薪難,0,0,0,3,1,1,0,0,0,0,0,0,0,0,0,0,0,240,0,0,0,0,0,0,0,0,0,0,0,0,0,0,0,0,0,0,0,0,0,0,0,0,0,0,2,0,0,1,0,0,0,0,0,0,1,2,241
2,職員,2023.03.06,2023-03,2018.01,主管是一個溫文儒雅的先生 真的感覺得出來他非常誠懇 然後問的問題沒有太多深入的題目 主要就是針對你的論文內容進行詢問 我覺得他很看人格特質 有種第一眼就決定面試是否成功的感覺 我覺得這主管真的是很老實 不會去為難別人 不會有壓力測試。論文的撰寫困難？照實回答。這家公司印象中是華創 現在也不在了吧 不過基本上裕隆集團真的很讚 到了鬼月還有放假跟旅遊補助 但也是很久以前了，不得現在還有沒有,0,0,0,0,0,0,1,0,2,0,0,0,0,0,0,0,0,195,0,0,0,0,0,0,0,0,0,0,0,0,0,0,0,0,0,0,0,0,0,0,0,0,0,0,1,0,0,0,0,0,0,0,0,0,2,3,192
3,物料管理實習生,2023.03.02,2023-03,2022.05,面試是以視訊面試進行，除了HR以外還有一個物料管理部門的主管（？）之類的長官，整體面試進行的蠻順利的，也沒有不被尊重的感覺，也有細心跟我解釋公司的一些制度還有需要實習生注意的項目。面試時間大概半個小時。自我介紹 3 分鐘？主要針對專業領域跟未來規畫進行描述，還有自己的特質（我是回答喜歡學習），並用經驗佐證。針對履歷內容問問題？(1)擔任幹部遇到的挫折及解決方式。(2)擔任公關時與廠商溝通遇過什麼難忘的經驗?。(3)詳述打工經驗和工作內容。(4)分享一下經營電商的經驗（履歷中有提到我有經營蝦皮賣自己的原創小物）。這部分因為有點私人又太細就不一一回答了。為什麼想來暑期實習? 想學到什麼?？提早體驗職場文化、讓自己的暑假有充實到、希望能在多做多問多學的環境中增強自己並補足缺失，還有因為自己的專業是工工相關，所以主要是說希望能發揮所學，並認識公司文化。最近關注的物流議題及對議題的看法是?？我回答的是有關外送平台的配送路線和顧客滿意度的議題。認為自己有什麼優缺點?？優點我回答有責任感，缺點我回答有時候會因為太有責任感變成濫好人，但最後面有說最近有在改善。有沒有投其他的實習? 優先去哪實習?？如實回答，我有提到如果其他家都有上的話才會綜合考量，但以實習內容而言對物料管理是有興趣的，所以會放在前幾順位。有什麼其他的問題?？我有問說需不需要準備什麼先備能力。可以多了解跟實習部門工作內容相關的時事議題，並有自己的想法。另外，履歷中與部門相關的經歷就算不太重要也可以放上去，HR可能就會問到。,0,2,0,0,0,5,0,1,2,0,0,1,0,0,0,0,0,647,0,0,0,0,0,0,0,0,0,0,0,0,0,0,0,0,0,0,0,0,0,0,0,0,0,0,9,0,10,2,0,0,0,0,0,4,3,12,647
4,職員,2023.02.16,2023-02,2021.06,先遠端考英文及專業測驗，大約1個半小時，而後開始視訊面試。面談大約進行一小時，面試官有3-4位，一開始先自我介紹，主管便循著履歷開始問問題，比較多開放式問答，專業的部分反而問不多，最後會留時間給面試者發問，可以事先準備幾個想問的問題。簡述碩士論文對該領域的貢獻？依實際研究成果回答。建議可以花時間看看公司官網跟永續報告書、想想為何想到裕隆上班？自身學經歷背景跟應徵職缺的連結等問題。,0,0,0,0,0,0,0,0,1,0,0,0,0,0,0,0,0,192,0,0,0,0,0,0,0,0,0,0,0,0,0,0,0,0,0,0,0,0,0,0,0,0,0,0,7,2,1,0,0,0,0,0,0,2,2,1,189
5,品質檢驗員,2023.02.10,2023-02,2022.12,大門換證帶小黃卡。人資帶到辦公室，考量測及英文。第一次接觸品檢很多量測題目真的看不太懂。後來主管面試，大致上介紹工作環境。聊以前工作狀況之類的。不過近來先是人力，三個月後轉正。面試花費的時間大概快2個小時。主管口頭直接給off了。為什麼要來我們公司？如實回答，不想輪班工作。薪資才3萬多一點，工作算輕鬆，內部主管幾乎都是靠年資上位，主管能力不足，都是靠底下員工溝通解決，希望有能力的人替代主管,0,0,0,1,0,1,0,1,5,0,0,1,0,0,0,0,0,197,0,0,0,0,0,0,0,0,0,0,0,0,0,0,0,0,0,0,0,0,0,0,1,0,0,0,2,0,0,4,0,0,0,0,0,3,6,2,196
6,製程改善工程師,2023.01.16,2023-01,2021.06,面試開始介紹自己之前工作經驗，自身學經歷汽車有關，問汽車相關知識，會問QC七大手法及WHYWHY分析，現場溝通及改善課題想法，承接儲能相關製程與改善設備優化，量測工時分析線上瓶頸工站，與解決各單位討論如何分配作業編成及作業人員充實度。為何會想進裕隆？自身學與維修都與汽車相關，上手時間快速，有改善想法(舉例)。如果你住在三義附近很適合在那裡混日子，裕隆不會倒，新事業(儲能，維運，醫材，ESG，對外服務)，事情很多讓你做不完，報告做不完，無意義的會議很多，很常當事務局,1,1,0,0,0,0,0,1,0,0,0,0,0,0,0,0,0,235,0,0,0,0,0,0,0,0,0,0,0,0,1,0,0,0,0,0,0,0,1,0,0,0,0,0,3,0,1,1,0,0,0,0,0,1,0,8,234
7,生產技術工程師,2023.01.10,2023-01,2020.08,首先會先了解你個人的特質，因為公司流動率非常的高，所以只要溝通沒有問題就可以直接進來，再來因為職務是生技工程師所以會開始了解你對於現場的狀態會不會排斥(簡單來說就是要快、品質要高、費用要低)，以及之後工作內容你可以幫忙公司帶入多少的效益。對於汽車你了解多少？因為本身並非汽車本科出身，所以對車子不了解，只知道四門兩蓋還有五油三水。除非你很喜歡寫報告、開會追進度，不然不要進來，尤其是跟現場有相關的。我一天8h可以開超過5場會，常常一件事情都沒做完後面已經排了10件事情在等，所以事情永遠做不完，然後還一堆會議追著你打,0,0,0,0,0,0,0,1,0,0,0,0,0,0,0,0,0,259,0,0,0,0,0,0,0,0,1,0,0,0,0,0,0,1,0,0,0,0,0,0,1,0,0,0,0,1,0,1,0,0,0,0,0,1,0,2,258
8,檢驗員,2022.12.13,2022-12,2011.08,我是應徵技能員，面試是科長及領班二人面試，面試會問你為什麼想來我們公司，我回答裕隆那麼大間當然想進來啊，再問平時有什麼興趣及消遣，我回答讀書考一些有用的證照、假日去逛街、看電影、衝浪等活動，然後會問你會在這裡做長久嗎？我回答當然會啊，不然我幹嘛來應徵。為什麼想來我們公司？裕隆那麼大間當然要來啊。別來這間公司做技能員，吃力不討好，做到老鳥了，懂的多了開始做工程師的工作，在這間公司對技能員很不友善，好的福利都是職員的，我做了11年，該考的證照考到了，不如歸去，如果你是來應徵工程職的歡迎。,0,0,0,0,1,0,0,0,0,0,0,0,0,0,0,0,0,245,0,0,0,0,0,0,0,0,0,0,0,0,0,0,0,0,0,0,0,0,0,0,0,0,0,0,3,3,0,1,0,0,0,0,0,3,0,5,244
9,資料庫工程師,2022.12.03,2022-12,2022.08,視訊面試，先進行職務相關筆試，題型分為選擇題及簡答題，大概一小時。英文筆試，題型同多益，大約一小時，都完成後，與主管進行視訊面試，同時有單位主管及人資。會詢問工作經歷，負責過哪些專案，主要在公司負責哪些職務。負責哪些職務？詳細回答目前負責的職務內容。可多準備要詢問主管的問題，能更了解公司。或對想應徵的職務，要如何精進，有什麼規劃讓自己更符合應徵職位要求。,0,0,0,0,0,0,0,0,3,0,0,0,0,0,0,0,0,179,0,0,0,0,0,0,0,0,0,0,0,0,0,0,0,0,0,0,0,0,0,0,0,0,0,0,7,7,1,1,0,0,0,0,0,1,4,0,178
10,生產技術工程師,2022.11.19,2022-11,2022.04,1.先做測驗(簡單力學、機件原理、驗車事項、邏輯測驗)。2.考完後主管面談，有經理/科長/人資，三對一面談。自我介紹後開始面談，內容主要以圖學概念、工作經驗、休閒嗜好等，有詢問可否加班，過程以一問一答為主，較少閒聊。3.一周後電話通知錄取。基本圖學/壓力排解等？圖學按照你懂得回答就好，不會刁難。力學簡單，有概念即可。原理部分主要考滑輪及彈簧。是否推薦此份工作：推薦，薪資對新鮮人來說算多，年薪也不錯。新鮮人可學到很多東西。其他注意事項：有員工宿舍，戶籍地址距公司50公里可申請,0,2,0,2,0,1,1,0,1,0,0,0,0,0,0,0,0,240,0,0,0,0,0,0,0,0,0,0,0,0,0,0,0,0,0,0,0,0,0,0,0,0,0,0,2,0,1,2,0,0,2,0,0,1,2,3,240
11,製程工程師,2022.10.23,2022-10,2022.1,面試前須填寫相關資料寄送給人資，面試時有做相關普化專業測驗及英文測驗。測驗約莫2小時。下午在進行面試，由兩位主管及人資作為面試，面談過程輕鬆，會問一些面試基本問題。工作環境如網上所說。福利條件人資大概會說明，跟104上的內容一樣。整體面試時間約3小時。對於塗裝了解？照實回答。專業測驗可以準備一下，大都是普化。英文測驗是類多益考試。職缺工作環境不是很好，福利還可以，可以去面試看看。,0,0,0,0,2,0,0,0,1,0,0,2,0,0,0,0,0,192,0,0,0,0,0,0,0,0,0,0,0,0,0,0,0,0,0,0,0,0,0,0,0,0,0,0,7,1,0,2,0,0,0,0,0,3,4,4,191
12,韌體工程師,2022.10.21,2022-10,2022.1,先自我介紹以及說明最近幾年的生涯規劃。接下來就是過往專業的問題，能答的話就答。若不知道或是沒接觸過就老實回答。主管人很務實，沒有想要考倒面試人的態度。整體過程很順暢，沒有什麼拖泥帶水。薪資部分不高，儲能這塊技術仍然處於發展中。很多關鍵技術都是採用外包方式。為什麼要來面試？老實回答即可以。若是新鮮人可以來這邊練功。福利基本都蠻齊全的。只是薪資普遍不高。不建議長期待，不缺錢或是想養老的除外。步調很慢,0,0,0,2,1,0,0,0,1,0,0,0,2,0,0,0,0,200,0,0,0,0,0,0,0,0,0,0,0,0,0,0,0,0,0,0,0,0,0,0,0,0,0,0,2,0,0,0,0,0,1,0,1,1,1,1,199
13,職員,2023.02.22,2023-02,2012.01,"1.面試過程1.先筆試(邏輯思考m 人格測驗, 英文考試等等) 2.筆試通過再進行面試。2.會先請您自我介紹之後, 會提問面試職類相關問題，例如商品企劃 就會問相關的經驗等等問題。3.福利條件可。4.整體花費時間約3小時。5.工作環境可。1.自我介紹？介紹與工作相關經驗與相關貢獻之回答。1.建議先了解面試職類，並收集相關職類資料等等 。2.了解公司基本的組織與發展策略與相關教育及福利等",0,0,0,0,2,0,0,0,0,0,0,1,1,0,0,0,0,195,0,0,0,0,0,0,0,0,0,0,0,0,0,0,0,0,0,0,0,0,0,0,0,1,0,0,6,0,3,2,0,0,0,0,1,1,0,3,193
14,數位行銷工程師,2023.02.08,2023-02,2019.08,第一階段: 現場一位課長(直屬課長)、單位副理、HR。1. 自我介紹1分鐘。2. PPT題目快問快答約五分鐘。3. 詢問履歷內容、面試動機等。4. 整體感覺偏尋找人格特質符合的人選。5. 沒有過多的技術性問題。第二階段: 現場一位部門經理、一位管理部副理、單位主管、單位副理、HR。1. 單純聊聊履歷，聊興趣。2. 對沒有行銷經驗的我，甚至建議我到職前K完一本行銷學的教科書。3. 能夠進第二階段基本上會錄取。什麼樣的長官是心目中的好長官？1. 目標明確。2. 主事客觀。3. 不情緒化。誠實應答，從面試官的問題可以分辨它是希望判斷你的人格特質或是你的技術能力。並根據觀察到的誠實應答，不要答非所問，比如說明明是想多了解你這個人，你卻一直把作品抬出來，這樣只會呈現出你答非所問的個性,0,0,0,0,0,1,0,0,1,0,0,0,2,0,0,0,0,342,0,0,0,0,0,0,0,0,0,0,0,0,0,0,0,0,0,0,0,0,0,0,0,0,0,0,5,0,1,0,0,0,0,0,0,1,7,3,339
15,採購管理師,2023.02.07,2023-02,2023.02,人資邀約面試，面試前提供基本資料，若無2年內英文測驗成績，要補考英文測驗(類多益、閱讀加上聽力)。三個採購主管跟人資一起視訊面試，主要針對個人經歷去詢問，整體面試時間約40分鐘。自我介紹會先請你1分鐘用英文，其餘再用中文自我介紹。第二次為實體面試，面試前要做完適性測驗，由二個採購主管，兩個其他部門主管及一個人資一起面試，首先會要你進行自我介紹簡報，接下來用白板解一個情境題，然後針對自我介紹簡報去提問，整體時間不超過一小時。你期望的團隊氣氛?？個人經驗回答。你最喜歡&討厭的主管是如何呢?？個人經驗回答。團隊合作例子? 以及你扮演的角色?？個人經驗回答。面試地點交通較不方便，在苗栗三義廠，建議為交通預留多一點時間。實體面試時會有專車從警衛室接送至面試地點。,0,1,0,0,0,0,0,1,4,4,0,0,0,0,0,0,0,331,0,0,0,0,0,0,0,0,0,0,0,0,0,0,0,0,0,0,0,0,0,0,0,0,0,0,12,0,3,0,0,0,0,0,0,2,7,6,331
16,人力資源管理師,2023.02.02,2023-02,2023.02,由於因為疫情關係由視訊的方式進行面試。人資會提前MAIL工作申請書給予填寫，填寫完回寄並要附上畢業證書、成績單以及相關證照資料。面試前會有考試。英文測驗若多益成績有達650分以上的話則不需要做測驗。因為工作需接觸到日商，溝通倚賴英文。所以對英文會有要求，英文成績沒達到就不予面試了。對於測驗的了解、建議？如實回答。因為高層是日商，所以對於英文能力很要求，。人資態度還算不錯。通過考試之後，才會進行下一階段的主管面試。,0,0,0,0,0,0,0,1,1,0,0,0,0,0,0,0,0,209,0,0,0,0,0,0,0,0,0,0,0,0,0,0,0,0,0,0,0,0,0,0,0,0,0,0,5,0,0,2,0,0,0,1,0,3,3,1,210
17,採購管理師,2023.01.04,2023-01,2022.11,面談有兩階段，第一次是線上面談，第二次要到三義廠區，時間都大約半小時左右，有要求提供畢業證書、成績單及英檢成績，沒有的話要另外測驗。/面談過程和諧，人資及主管都相當親切有禮，主要針對履歷及簡報詢問，第二次面談需要做簡報，包含自我介紹及情境題。請問你過去最大的成就感是什麼？分享過去工作經驗的成果：議價低減的成本、解決航運的緊急狀況等等。可以先上官網了解公司，裕隆日產與裕隆汽車是兩家不同的子公司，裕日車沒有生產製造，大部分是辦公室性質的工程師及管理師,1,1,0,0,0,1,0,0,2,0,0,0,0,0,0,0,0,226,0,0,0,0,0,0,0,0,0,0,0,0,0,0,0,0,0,0,0,0,1,0,0,0,0,0,2,0,1,1,0,0,0,1,0,0,2,5,226
18,行政專員,2022.11.07,2022-11,2022.1,進去先填寫資料，填寫完等待廠長面試，先簡單基本自我介紹，廠長會邊看履歷變問問題，問的問題都是履歷上的問題，問完會開始講解公司制度，工作時間是8:30開始，大部分的人都會8點前到先整理環境，8:20宣布今天的事，會經常性加班到6:30左右。對數字敏感嗎？照實回答。這份行政專員的工作，適合有做過會計的人。有第二次面試需要到新竹總公司面試，面試官是財經部到經理。基本的文書處理要會跟熟悉,0,0,0,0,0,2,0,0,0,0,0,1,0,0,0,0,0,192,0,0,0,0,0,0,0,0,0,0,0,0,0,0,0,0,0,0,0,0,0,0,0,0,0,0,6,0,0,2,0,0,0,0,0,0,1,2,189
19,出納專員,2022.11.03,2022-11,2022.07,在中部據點面試時主管們態度超好，把你當客人看待，態度和藹可親，環境氛圍輕鬆。但是錄取一個月後就是噩夢的開始：。1. 薪資，面試時說碩士高於32000，因為32000在公司是大學畢業生的價碼，結果拿到薪資單一樣只有32000左右，頂多33000。2. 加班，薪資沒增加就算了，但上班要提早去打掃和點名，下班工作沒做完要先打卡，做完才能走，如果你直接走，隔天一定會被唸。基本上每天都會延遲下班。3.不能有問題，要求新人教一次就要融會貫通，問問題一定會被唸，動作比較慢也是。4.新人一犯錯到最後直接罵，什麼都罵，發現你學比較慢就對你貼上不認真的標籤，從此沒好日子過，基本上每天都會被罵，就算撐到下午，一樣會找事情電你。5.有問題不聯絡你，打電話直接到家裡，這點我真的傻爆眼，我接起來跟我說要找X先生（我爸的名字），結果是講有關我的事情，我爸直接請他打給我。6.工作雜到不行，業助的工作也是你的工作。7.考核會出鳥題目，各種刁鑽狀況，你應付得卡卡一樣被唸，前輩會演奧客來讓你考試。考當日帳款確認也會故意把帳弄亂，讓你在短時間內要把帳抓出來整理清楚，一樣太慢或是找主管討論會被唸。8.交接根本不是交接，最後一天要歸還東西了，還要你繼續把交接表上列的工作做完才能走，請問這叫什麼交接？都做完了還交接個毛？導致我隔天還要再跑一趟辦程序。9.主管休假還會打電話到公司電你，沒接到他的一通電話就直接爆氣說為什麼掛他電話？上班根本很少用手機，打line沒接到不知道在氣什麼。自我介紹？依照你準備的實講即可，基本上就是輕鬆的聊天，很容易錄取，因為出納職位超級缺人。如果你夠奴再來，基本上每天都要加班，沒加班主管還會跟同事私底下抱怨你，請假也會被講壞話，就是一個很表面的公司。面試時好聲好氣，錄取後各種刁難，離職也不會放過你，壓榨到最後一刻，表根本沒有什麼工作需要交接的。有問題跟中階主管反應也沒用，絕對挺資深專員，甚至我離職想當面道謝也放我鴿子，說離職手續當天可以直接去位置找他，結果他休假，明明前一天還有通電話確認。總之中部據點絕對不要來！,0,0,0,3,2,3,1,1,6,1,0,1,0,0,0,0,0,861,0,0,0,0,0,0,0,0,0,0,0,0,0,0,0,0,0,0,0,0,0,0,0,0,0,0,6,0,0,6,3,0,0,1,0,0,5,6,863
20,實習生,2022.10.22,2022-10,2022.06,視訊面試 + 多對一面試：會先和其他應徵者進入會議室A，而且是所有部門的應徵者。公司主管會簡單介紹裕日這間公司，算是一個小暖身，然後會一個一個唱名輪流離開，去另一個會議室(代稱會議室B)。進入會議室B後，有各部門主管，整個對話只有五分鐘，就我所知五分鐘是固定的時間，但如果表現很好說不定會更久。排序最想去的部門？由於我並沒有想到會是各部門主管的多對一面試，因此沒記熟所有部門名稱，排序時有漏掉的部門，是本次面試的一大敗筆。用一句話形容裕日？「有活力的年輕人」是我給出的答案，因為我認為裕日的宣傳手法頗為新潮，當時官網上有心理測驗、Instagram似乎有攝影活動，但現在回想起來這個解釋不夠有說服力，所以建議可以先自己想好，不要像我臨時擠出這個破答案。語氣肯定、表現大方很重要，各部門在做什麼最好都要先了解一下，自我介紹一定要準備，大概2分鐘就好。主管的反應大部分很冷漠(不知道是不是因為我很糟還是是故意營造的氣氛)，祝各位求職順利,0,0,0,0,0,0,0,0,4,0,0,0,0,0,0,0,0,417,0,0,0,0,0,0,0,0,0,0,0,0,0,0,0,0,0,0,0,0,0,0,0,0,0,0,5,3,0,0,0,0,0,0,0,0,4,7,416
21,職員,2022.10.19,2022-10,2019.01,"沒有近期多益成績的話就必須先上機考多益, 考完後人資會將成績給部門主管後進行面談, 基本上部門主管過關的話就差不多穩了, 第二次面試是人資跟其他高層, 就問一些未來的規劃, 想獲得的東西, 苗栗三義比較遠沒有交通工具, 去之前要想清楚.。中英文自我介紹？照自己的稿說一說。未來的規劃？照實說就可以。2022年有一票辦公室正職員工離職, 因為產品力不足賺不到錢, 導致裕日的薪資跟不上業界水平, 工作越久領得越少, 而且組織派系嚴重, 不建議到這間公司任職",0,0,0,1,0,0,0,0,2,1,0,0,0,0,0,0,0,228,0,0,0,0,0,0,0,0,0,0,0,0,0,0,0,0,0,0,0,0,0,0,0,0,0,0,1,0,0,1,1,0,0,0,0,2,4,2,227
