,vacancies,post_time,p_year_month,interview_time,content,成就感,學習成長,創新,薪資,福利,管理制度,工作氛圍,同事互動,主管風格,工作地點,公司規模,工作環境,產業前景,輪調,外派,出差,引擎,馬力,避震,外觀,操控,安全,堅固,配備,價錢,科技,品質,折舊,品牌,空間,保養,續航,尺寸,車種,驅動,變速箱,電資,機械,製造,車輛工程,品管,多元性,企業社會責任,企業永續目標,面試,徵才,實習,工作,離職,轉職,新鮮人,畢業,出路,能力,招募人員,正向,負向
390,輪班技術員,2023.01.02,2023-01,2022.11,在官網投遞履歷之後，記得每天都去查電子信箱，因為公司在電話通知面試之後，你要在這段時間檢查信箱裡有沒有收到附件，因為他們會寄出一些資料，需要你填寫。建議找ok的人，幫忙審視你填寫的東西有沒有什麼紕漏，個人認為有些問題很危險（很陷阱）。然後面試前幾天記得把回傳過去的文件列印下來，以免到時候人事表示沒有收到，需要你當場重寫一份。當天早上，記得早起填寫健康聲明書（印象中要在早上8：00前送出）並保留前一天晚上或是當天早上快篩結果的照片。我在6廠面試，當時是一批人過去的面試（大約2、30人左右），進去之後，櫃檯小姐會告知不能使用手機，到了面試的時間，他們會一個一個叫出來（要記得自己當時的號碼），排好隊，在看完快篩結果後，會要求我們把手機關機放入信封袋，並把自己的號碼告訴櫃檯後，就可以跟著隊伍先去筆試。筆試的內容有：英翻中（單字）、中翻英（單字）、基本的數學題目、短期記憶長單字以及最重要的適性測驗（電腦操作）。接下來就是去適性測驗旁邊的等候區，邊看公司的影片邊等待主管叫你去面試。是什麼原因促使你想留在台灣工作？這裡建議謹慎回答，盡量不要把一些規劃說出來，因為他會問就代表他們現在要的是穩定留在這裡的員工。當時我是回答：我其實有在精進自己的語言能力，想在未來跟著貴公司去亞利桑那州的廠工作。後來我意外認識一位經理（家裡人的朋友的小孩），他幫我詢問原因，我才知道那時候我是因為這一題被刷下來的。請問你的身心有什麼樣的狀況呢？這裡的話，我是建議能承受上班的時候高壓狀態的人，謹慎回答。主要是，如果被發現隱匿不報，我不曉得後果如何，但是誠實告知，對方會有所考量。但是我是選擇隱匿不報，因為我的疾病不算什麼大問題，也不會因為高壓環境而加重，所以我就回答：沒有，身心健康。記得一定要認真的看待面試，並表現出自己真的很想進去就業的態度。適性測驗中，選擇合適的答案去點，因為有時候太誠實會失去機會。面試的過程中，不要有抱怨等負面字眼，盡量表現的有禮貌。當天一定要攜帶紙、筆、事先把對公司的理解與職位的理解記下來（如果能記住，那更好）、列印下來的回傳文件&畢業證書（主要是怕人事那邊沒有收到回覆）、能補充能量的飲料&零食。大抵上，是這樣。,0,0,0,0,0,0,2,0,1,0,0,1,0,0,0,0,0,913,0,0,0,0,0,0,0,0,0,0,0,0,0,0,0,0,0,0,1,0,0,0,0,0,0,0,11,1,0,2,0,0,0,1,0,3,1,8,909
391,技術員,2022.12.30,2022-12,2022.12,先在櫃檯繳交手機（會先給你信封袋裝）。之後集體在座位區寫英文考題（網上有題目）。寫完後帶去做性向測驗，之後等待叫號一個個面試，主要問的內容如下：。1.對台積電的了解。2.自我介紹。3.優缺點。Ps.在面試之前要先填寫面試資料，問卷等等在面試前三天就要先繳交（e-mail）。對台積電的了解？如實回答，最好先在網上查詢介紹等等。最好先在網上查詢產業的介紹等等，如果有親戚在台積電工作，在三天前的問卷會有要填寫的地方，主要是面試之前的準備比較複雜，一定要注意email訊息,0,0,0,0,0,0,0,0,0,0,0,0,0,0,0,0,0,235,0,0,0,0,0,0,0,0,0,0,0,0,0,0,0,0,0,0,0,0,0,0,0,0,0,0,5,0,0,1,0,0,0,0,0,0,0,3,235
392,Engineer,2022.12.28,2022-12,2022.12,面試流程如下：台積招募處報到 -> 人格測驗 -> 英文能力測驗（30分鐘）-> 主管面試。主管面試流程：主管自我介紹 -> 自我介紹 -> 碩論提問 -> 部門與工作內容介紹。整體面試非常舒服，主管非常尊重面試者，若有問題可以隨時提出，他會非常樂意回答。在過往的工作經驗當中有遇到什麼難處？照實回答。台積面試主要會有兩階段，第一階段我並沒有被問太多專業問題，主管主要詢問碩士論文和大學碩班的社團經驗分享，透過你的分享了解你的人格特質是否符合該部門的需求，只要流暢並照實回答即可。,0,1,0,0,0,0,0,0,6,0,0,0,0,0,0,0,0,241,0,0,0,0,0,1,0,0,0,0,0,0,0,0,0,0,0,0,0,0,0,0,0,0,0,0,6,0,2,2,0,0,0,0,0,2,5,4,239
393,RD工程師,2022.12.28,2022-12,2022.12,這次應徵為竹科EUV（Extreme ultraviolet lithography）研發工程師，整個過程大約1小時15分鐘。另外，加上我在面試前有些急事正在處理，導致我有點緊張。這次面試有兩位面試官，但是只有一位在問我問題，另一位沒怎麼說話。首先，他們請我用十五分鐘進行自我介紹（我想起之前在面RDPC、CMP的時候我講了大約25分鐘要我快點結束，因此我害怕是不是一樣的情況，所以用超快的語速把自我介紹、專題研究和論文研究壓縮在15分鐘內），結果他們就問我是不是很緊張，我說是的，並要我不需要那麼緊張只需要當作是討論或是閒聊。接著開始介紹他們的工作內容，主要是提升EUV曝光機打在光罩上的小型機構（類似機械手臂）的運作良率。在研究方面，主要是分析光學與機械的問題。工作上會與艾司摩爾進行合作；內部計畫主要是做機台產能提升、降低雜質，具體來說像是用靜電或是氣流將小顆粒（deface）去除；調整光源強度（高能二氧化碳）；最後是進無塵室的時間大約是每個月待20小時。在新人訓練方面，由於EUV為最新技術，因此不論之前碩論研究什麼，大多數的人一定都會去台中訓練（面試官說3個月，但是之前我打聽到的是2個月，或是是該技術比較特別之類的），回到部門後約6至9個月為新人期。輪班方面，小夜班為1至2個月輪一次，連續6天；大夜班4至6個月輪一次，連續6天。在團隊合作部分，大約20個人使用一台EUV設備，並分成好幾個小組研究各機台部位。請描述自身的優點與缺點？優點部分：在自我介紹看到我的學歷以及專題研究和論文研究非常多樣後，我以此為出發點跟面試官說我對於新事物的適應能力很好。缺點部分：當我有很多事情一起面對時容易感到焦慮與緊張，最近因為經歷過的經驗較多，比較能夠適應。這份工作是否適合你，1到10分？我給7分，原因是我自認自己並非相關科系出身，所做的研究較無關係，但是能夠靠著快速的學習能力適應。這份工作的工作環境評估，1到10分？我給8分，經過與面試官的對談，大致了解到工作模式與環境，但是或許想像與現實有所落差。加上根據面試官先前提到的相關工作壓力，雖然壓力是不可避免的，但還是不覺認為那是缺點，因此扣2分。（接著面試官跟我稍微講解關於壓力的產生與化解之想法，算是他的人生經驗）。你看起來很緊張，請問是平常就這樣，還是面試時才這樣？我說是因為在面試前有些急事正在處理，導致我有點緊張。心裡還卡著其他事情，所以才會表現得那麼緊張。另外補充：我在工作內容詢問環節的部分覺得問得差不多的時候，最後的問題是我問面試官：「請問就剛剛面試的表現中，我需要改進什麼地方嗎？」面試官就提點說我剛剛太緊張了，不需要那麼緊張，就當作是在進行資訊交流與溝通而已。給了我蠻多建議。你在設備、廠務及設備助理工程師應徵問卷前三項填選否，請問你選擇的原因？問卷上的敘述在當下看的時候覺得太誇張，認為這會傷害到我的健康，因此才會選填否。另外，在前面幾場面試中的資訊交流大致了解到並非如問卷上寫得那麼誇張，因此大致還在可接受範圍之中。如何調解工作壓力？會跟一些實驗室畢業的學長聊聊我發生的狀況，討論一些能夠解決或是排除問題的方法。另外就是去進行爬山運動之類的活動。之前遇到的困難與解決的方式？（我這題答得不太好，有點難自圓其說）我提到之前產學合作計畫失敗，如何構想計畫之類的方式。（我覺得還是選碩士論文換題目，我是如何振作的過程會比較好）。除了面試台積電之外，你還有面其他公司嗎？只找台積電還是有找其他軟韌相關的公司？我說有一家，是在做自動化控制器的公司。目前沒有，主要是因為台積電名聲與薪水等消息吸引我來面試，所以還沒開始找其他公司進行面試。以下是我問面試官的一些問題：。Q1. 工作上日常主要負責工作項目有哪些？像是有什麼職務範圍？。A1. 硬體維護、機台錯誤（error）解決。Q2. 這份工作最困難得且最有挑戰性的地方？。A2. 在時間壓力下，由於是最新機台EUV，所以需要透過閱讀一些論文嘗試新方法實驗。Q3. 這份工作績效如何評估衡量、考核標準會依那些做為評定？。A3. 機台效能提升、降低雜質率等KPI。Q4. 這個部門大家的工作氣氛狀況？。A4. 節奏快、合作模式佳、壓力大（需要時常溝通），建議我要常冷靜。最後面試官說可能會有二面，或許以電話方式進行，因此提供電話號碼與電子信箱。這個情況也是我面試到第四場第一次發生的狀況。,0,1,0,1,0,3,7,8,0,0,0,3,2,0,0,0,0,1803,0,0,0,0,0,0,0,0,0,0,0,0,0,0,1,0,0,0,3,2,0,0,0,0,0,0,34,3,2,14,0,0,0,1,0,8,10,11,1795
394,薄膜磊晶設備工程師,2022.12.28,2022-12,2022.12,本次面試的廠區為南科F14B EPI設備部門，整個面試流程大約1.5小時。最先一開始自我介紹、專案成就以及論文研究這三個小部分，我用PPT進行並大致將時間壓縮在20至25分鐘左右。接著面試官開始介紹他們部門的主要工作內容，分為四個部分：。1. 機台預修保養PM（Preventive Maintenance）：新人剛進去算是以收拾殘局為主。佔一週工作時間約20%至25%。2. 值班依據派工內容進行，時間大約是08:30至17:30。佔一週工作時間約20%。3. CIP（Continuous Improvement Process）改良改善長期計畫：由於設備機台折舊，需要調整參數對機台性能進行提升。佔一週工作時間約20%至30%。4. 設備保養清潔、（耗損）零件更換。佔一週工作時間為上述其他剩餘時間。輪班時間（表定時間）：日班：08:30-17:30、小夜班：15:30-00:30、大夜班：00:30-08:30。新人訓練方面：約2個月去台中訓練中心學習基礎理論，並依據部門學習常用工作內容。排錯（Troubleshooting或是problem shooting）基本上是以3至4人同時進行。在KPI方面，主要配合製程部分。輪班你能夠接受嗎？該題是設備工程師面試必問的問題，他是根據我選填的《設備、廠務及設備助理工程師應徵問卷》進行提問，我在前三項：。1. 長時間站立走動、操作機台，有些機台維護保養可能超過6小時。2. 配合三班制日夜輪班與班別安排。3. 因有時須協助搬運機台或零件，故體能可以負荷搬運或揹負重量在二十公斤以上的機台零件等物體。都勾選「否」，所以會再次確認你能否勝任這份工作。而我的回答是：根據問卷上的描述再比對先前與面試官的描述，我認為問卷描述過於誇大，我覺得還是能夠在我自己能夠承受的範圍之內。對於本次面試我認為最主要在於因為遠端面試，所以可以利用紙筆的方式進行記錄。另外我面試的該面試官喜歡在最後的20分鐘聊一些跟工作無關的話題，像是你有什麼休閒嗎？南部天氣比北部還要好，很溫暖之類的話題。總而言之，我想說的是突然從比較嚴肅的話題（盡管面試官一直都很和善）轉換到家常閒聊，腦袋有點轉不過來。另外，面試官有些不急的會希望你多問他一些問題，然而我只有準備五六個非常廣義的問題，導致我自認好像互動有點少。根據多問延伸出，面試官一直希望我如果要進設備工程師要三思之類的建議。,0,2,0,0,0,6,0,2,0,0,0,0,0,0,0,0,0,1000,0,0,0,0,0,0,0,0,0,1,0,0,3,0,0,0,0,0,0,0,1,0,0,0,0,0,14,1,1,8,0,0,0,0,0,0,6,4,999
395,職員,2022.12.27,2022-12,2022.03,第一關主管面試，有自我介紹，問了蠻多問題，也說了職位上的需求。第二關人資面試，沒有自我介紹而是直接問問題，問了很多題目（比較瑣碎），和網路上提到的題目大致相似，但會依照回答往深處問更詳細，這關比較難。第三關是筆試（考適性測驗及英文試驗）。為什麼會選擇投這職缺？因為先前工作發現對於設備相關有興趣，而且在分析時候也需要進行設備相關的維修及保養，希望有機會可以朝這方向發展。人資面試這關需要多花點心思準備，再加上自己英文程度不太好，筆試的部分有考聽力和寫作，沒有公佈成績可能人資面試及考試狀況沒有發揮好導致沒有錄取。,0,0,0,0,0,0,0,0,1,0,0,0,0,0,0,0,0,257,0,0,0,0,0,0,0,0,0,0,0,0,2,0,0,0,0,0,0,0,0,0,0,0,0,0,7,1,0,1,0,0,0,0,1,0,4,1,255
396,PVD製程技術員,2022.12.25,2022-12,2022.08,一開始早上8點半到6廠大廳面試報到 就開始點名 發考卷 一開始選擇題 後面第二關 默寫單字大概有10幾個字母 有點難度 再來就是電腦的人格測驗  俗稱的台積DNA人格之後主管面談會問一些經歷和自我介紹 有通過主管的面談會留下來到人資面談會講一些生活雜事之後就等通知。問一些之前工作經歷？就老實講。14廠P3 PVD是一個不太好的環境 會欺負一些菜鳥然後對新人不尊重不爽直接黑了你 在台積裡面是離職第一名的單位 所以進去要做好心理上的建設不然很容易崩,0,0,0,0,0,0,0,0,3,0,0,1,0,0,0,0,0,225,0,0,0,0,0,0,0,0,0,0,0,0,0,0,0,0,0,0,0,0,0,0,0,0,0,0,3,0,0,1,1,0,0,0,0,0,3,2,224
397,製程工程師,2022.12.25,2022-12,2022.1,D：官網投遞履歷，建議認真詳實填寫，於面試時都會做確認並從中提問。D+7：主管面試，採用線上面試，主要做論文簡報及互相提問，建議論文必須熟悉且能清楚。表達實作或是研究這篇論文的目的與結果，有詢問是否有半導體相關經驗，若有匯市加分項。D+14：人資面試，採用視訊面試，對履歷做詳細核對並確認履歷核實的聯絡對象，面談著重人格特質、遇到挫折的抗壓性及團隊合作經驗，希望錄取積極且能配合團隊的理性溝通者。詢問是否能配合輪班及小夜值班？請問頻率後表示可以接受。詢問是否有半導體相關的經驗或知識?？舉例修習台積電開設之課程與課堂專案之實作結果做說明。詢問人格特質/缺點，並舉例說明為何有這些特質/缺點？提出自身優點並舉例。詢問遇過最挫折的事?如何調適心情?如何解決?？提出自身經驗並舉例。詢問團隊合作並舉例?如何溝通?合作失敗/成功的例子?？提出自身經驗並舉例。詢問是否有展現積極性的事蹟並舉例？提出自身經驗並舉例。介紹論文，並說明解作動機與實現的困難處，最後說明如何解決及與教授溝通過程？說明設計目標與創新性，並闡述實驗過程與最後結果。與教授平常相處模式及教授在學業上扮演甚麼角色?？提出自身經驗並舉例。1. 建議口條要清晰有邏輯，能對於自己提出的優點或是闡述的論點舉出實際的例子，並以該例子做延伸強調為何遇到此問題並說明解決或是克服的方法。2. 務必詳實填寫履歷與簡報。,0,1,1,0,0,3,0,6,1,0,0,0,0,0,0,0,0,582,0,0,0,0,0,0,0,0,0,0,0,0,0,0,0,0,0,0,0,0,0,0,0,0,0,0,13,0,8,0,0,0,0,0,0,8,2,10,579
398,技術員,2022.12.24,2022-12,2021.03,履歷要進去招募網站填好，再把相關資料列印出來，面試當天要帶去繳交。可以先準備TSMC常用英文單字，會考英文跟數學。先到櫃台量體溫、手機關機放櫃台不要帶去，到大廳等待考試。考完試回到等待區繼續等待，會被叫出去面試，過程大約10分鐘。介紹工作內容、廠區，強調工作12小時不可以使用手機，做2休2，中間休息2小時。面試結束之後回去等通知。工作遇到最大的挫折是什麼？怎麼解決？舉實際遇過且已經解決的問題。對公司的了解？可以先了解公司的網站、影片比較好回答。錄取會租房或是通勤？租房(高雄人)。1. 先準備 TSMC 常用英文單字。2. 了解公司在做什麼。3. 了解職務的工作內容，可以準備一、兩個問題提問。4. 注意穿著，不要太隨便,0,0,0,0,0,0,1,0,0,0,0,0,0,0,0,0,0,313,0,0,0,0,0,0,0,0,0,0,0,0,0,0,0,0,0,0,0,0,0,0,0,0,0,0,5,1,0,4,0,0,0,0,0,1,0,2,309
399,RDPC,2022.12.24,2022-12,2022.09,"主要有兩個個人幫你中文面試一個為經理及處長，那主要都已經理在跟我面試而處長只來了5分鐘就走了！那已處長的建議及口氣來聽RDPC是一個壓力很大的職缺。因為他們介於其他RD和EE之間RDPC須先量在有限時的時間量產出來來檢測良率才會往下丟給EE。自我介紹、介紹RDPC、瘋狂問ppt上及官網上填的資料、處長發問？自我介紹我自己有做ppt,RDPC介紹大概與上面說的一樣。那再來就是問全部關於你自己的東西。最後處長問朋友都如何形容你及當你在操作機台時發現按錯怎麼辦？我的回答我會先reset減少損並馬上與主管報備！。主要面試問題不難，大部分都是問自己相關的只要你夠了解妳自己己應該是沒什麼問題！但總體面試的感覺像是在聊天不會很緊張！",0,0,0,0,0,0,1,0,1,0,0,0,0,0,0,0,0,314,0,0,0,0,0,0,0,0,0,0,0,0,0,0,0,0,0,0,0,0,0,0,0,0,0,0,4,1,0,0,0,0,0,0,0,0,1,2,313
400,RU design rule,2022.12.23,2022-12,2022.07,"使用teams視訊面試, 一次好幾個人一起面, 有主管有工程師, 會輪流問問題, 因為我是有工作經驗的, 所以大多都問過往的工作經驗, 主管蠻和善的不會刁難問奇怪的問題, 一面後3天內就收到2面通知。2面一樣視訊面試, 會先面HR, HR會問一些人格個質問題, 再面更高階主管, 主管這邊一樣一次好幾個人一起來, 但我本身工作經驗不是很相符, 所以後來沒有錄取。遇到困難怎麼處理?？舉一個在工作上遇到的困難情境, 這部分最好事先設想好才會講得順, 最後必需要講怎麼化解困難。工作經驗描敘？依個人經驗回答。怎麼會想換工作?？這個最好不要講得太像掰的或太假, 依照實際情形講就好。這個部門主管給我感覺非常和善, 好相處, 工時看起來也不會太長, 也不用輪班值班, 在台積電裡算是個不可多得的好部門, 但是還是要有相關經歷會比較好錄取",0,4,0,0,0,2,0,0,5,0,0,0,0,0,0,0,0,365,0,0,0,0,0,0,0,0,0,0,0,0,0,0,0,0,0,0,0,0,0,0,0,0,0,0,8,0,5,6,0,0,0,0,0,0,7,5,357
401,作業員,2022.12.23,2022-12,2022.12,9:00到會先將所有面試者集中到一個地方先考英文單字(題庫會事先給，基本上有背都會過)+國小數學(考邏輯跟細心程度)。考完之後有部分的人會接著考英文默背(當天約有16人參加面試，第一輪結束刷掉2人，參與第二輪的大約有8人，其他人沒有參與英文默背直接進入面談)。英文默背就是主考官現場發下5個超長的英文單字，限時15分鐘要背完，接著開始默寫，我當下五題有寫了三題。考完之後有瞄到有部分人是完全空白沒有寫的，當然他們就被刷掉了(此階段約刷掉3位)。接下來就會去寫適性測驗(因為我之前有寫過了所以這次就沒有再寫)直接等面談。面談大約的內容就是問家裡的狀況、來自哪裡等等，沒有太艱深的問題。主要都是靠面試官的感覺，當天面試過程中從一開始就覺得我跟面試官沒有緣分，從頭到尾並沒有講述應徵的工作內容，直到我詢問她的時候才做說明，感覺上並不是很好。最後沒有面試到HR，基本上是無望了(當下告知回去等通知大約3~4周)。當天9:00開始考試等到面是結束大約是11:45左右。家庭成員狀況？如實回答。家中成員、分別工作內容。是否有貸款壓力？如實回答。有學貸、保險等等。居住地在哪？如實回答。因為我是住在外縣市，基本上我回答到這邊面試官就已經不想跟我聊了。為甚麼想來台積電？存錢。整體面試過程確實是大公司的規模，但中科跟南科的面試內容不太一樣，規模也不一樣(南科規模比較大)，可能現在應徵作業員的也很多，競爭力相對的也很大，最基本的考試的部分一定要拿到分數，面試基本上就靠緣分了，沒有甚麼技巧但也不知道標準在哪邊，想應徵的都可以去試試看，說不定你跟面試官有緣分,0,0,0,0,1,0,1,0,0,0,3,0,1,0,0,0,0,671,0,0,0,0,0,0,0,0,0,0,0,0,0,0,0,0,0,0,0,0,0,0,0,0,0,0,11,3,0,2,0,0,0,0,0,2,6,2,669
402,DTP,2022.12.22,2022-12,2022.1,當時直接就我的PPT 內容進行問答另外會針對你的學歷去做詢問跟科系，學過哪些專業科目，有沒有什麼專案的實習經驗，另外有提到有沒有使用過 哪些 tool command language 等等。，我的經驗是一面收到兩個。針對你的學歷去做詢問跟科系，學過哪些專業科目，有沒有什麼專案的實習經驗，另外有提到有沒有使用過 哪些 tool command language？直接回答自己有做過的專案等等內容。最好直接投跟部門工作內容有相關的，我是一開始。想找的類型就很明確是電路設計相關的工作，因此也只有相關工作的主管來面試,0,0,0,0,0,0,0,0,1,0,0,0,0,0,0,0,0,258,0,0,0,0,0,0,0,0,0,0,0,0,0,0,0,0,0,0,0,0,0,0,0,0,0,0,4,0,8,3,0,0,0,0,0,2,1,1,258
