,vacancies,post_time,p_year_month,interview_time,content,成就感,學習成長,創新,薪資,福利,管理制度,工作氛圍,同事互動,主管風格,工作地點,公司規模,工作環境,產業前景,輪調,外派,出差,引擎,馬力,避震,外觀,操控,安全,堅固,配備,價錢,科技,品質,折舊,品牌,空間,保養,續航,尺寸,車種,驅動,變速箱,電資,機械,製造,車輛工程,品管,多元性,企業社會責任,企業永續目標,面試,徵才,實習,工作,離職,轉職,新鮮人,畢業,出路,能力,招募人員,正向,負向
137,FAE工程師,2023.02.10,2023-02,2023.01,當時就兩個高階資深工程師進來跟我聊天，過程中有詢問我是否用過頻譜分析儀(一種很昂貴的器材，一班的大學不太可能會有，因為這種儀器很敏感，對於使用環境要求相對嚴苛)，我就說沒有，但是有聽過，後來就是自我介紹，聊了一會還算可以。自我介紹？大概說一下你的狀況，專業強項，認為的優缺點，對這工作有何想法，興趣星座甚麼的不要說，因為是浪費時間。後來主觀就進來了，流程上大致就是介紹一下自己，把可以對自己加分的東西講出來，並且她會對此作紀錄，並針對你說來的關鍵字提問。整個面試過程流暢不拖泥帶水，差不多一小時左右，但就是沒上。就多準備一點吧。,0,0,0,0,0,0,0,0,1,0,0,1,0,0,0,0,0,265,0,0,0,0,0,0,0,0,0,0,0,0,0,0,0,0,0,0,0,0,0,0,0,0,0,0,1,0,0,1,0,0,0,0,0,1,0,3,265
138,高級工程師,2023.02.06,2023-02,2023.01,面試前先考線上英文測驗仿多益 。之後一面與副理視訊面試。副理會著重問碩論以及專業知識的問題。建議準備PPT。之後二面是經理。經理大部分都是閒聊 所以沒有什麼特別困難的地方。再來是第三面 處長。處長有問及到對於LCD的了解 部材元件的用途等等。有面試其他公司嗎？有。建議準備PPT 並且要有表達清晰的能力。對於自己的專業要有自信的回覆。表達對於這份工作有第一志願的態度。才有機會進入後面的關卡,0,0,0,0,0,0,0,0,0,0,0,0,0,0,0,0,0,196,0,0,0,0,0,0,0,0,0,0,0,0,0,0,0,0,0,0,0,0,0,0,0,0,0,0,7,0,0,1,0,0,0,0,0,4,2,1,194
139,軟韌體工程師,2023.02.02,2023-02,2022.01,首先先自我介紹並介紹論文，友達面試是由主管親自挑履歷及聯絡面試者。接著主管提問說並說明為什麼想來面試此職務？。及為什麼會想往車載系統發展？。接著主管介紹職位，智慧車載軟韌體工程師。主要工作是用C發展，撰寫MCU FW，並會做車用安全性測試等。工時正常，有加班費。為什麼想來面試此職務？我覺得智慧車載在未來的發展性很好，。希望可以投入此產業進行研發。此職位是智慧車載軟韌體工程師，因車用產品的文件量很大。以後面是此職位的朋友要注意，公司很在意功能安全性相關。最好是對ISO26262或是ASPICE有相關了解。,0,0,0,1,0,1,0,0,3,0,0,2,0,0,0,0,0,255,0,0,0,2,0,0,0,0,0,0,0,0,0,0,0,0,0,0,0,0,0,0,0,0,0,0,5,2,0,1,0,0,0,0,3,0,3,8,255
140,機構工程師,2023.01.31,2023-01,2012.08,面試總共分四階段，第一階段為直屬主管面試，基本會問你前一份工作與相關專業知識。有提供紙本可以現在進行簡易繪製與說明。第二階段為上級主管面試，針對個人特質詢問與為何想來公司。第三階段為處長級面試，基本問得與二級主官差不多。第四階段為HR面試，有進行問題的壓力測試，會一直針對你的回答往下問，直到答不出來為止。後面有說明是要觀察反應與壓力測試。為什麼想來公司？公司風氣很適合自己。專業相關知識，與上一份工作內容？照實回答。因為當天是一天內面試所有主管，建議放輕鬆。否則下午最後一場會很疲憊。面對人資的壓力測試，就按照自己的邏輯清楚回答，不用動氣去爭辯，只是需要看各人反應能力而已。,0,0,0,0,0,0,3,0,3,0,0,0,0,0,0,0,0,289,0,0,0,0,0,0,0,0,0,0,0,0,0,0,0,0,0,0,0,0,0,0,0,0,0,0,6,0,0,2,0,0,0,0,0,4,5,3,286
141,演算法開發工程師,2023.01.18,2023-01,2021.01,"非面板同行者，通常不會問這方面的知識，而是從大方向切入。面相大學或研究所課程的內容，光學/影像處理/色彩學等，看職位而定。此職缺主要是影像處理方面，內容非常簡單，大學的Hello World程度就可以對應。另外就是問程式語言會什麼，目前公司把C#統一作為前端以及後端。至於Python/Matlab..等等那些，實際工作內容根本不會用到。影像處理？建議做一點功課，主要是問了MiniLED Demura的補償原理，。以及具體上的現方法。※績效※。除了白紙黑字的保14以外，績效/分紅通通不建議期待；。尤其是專案會複雜的，績效都會比簡單輕鬆的專案還低。東西越多越難做完整，但老闆就是會挑毛病；。反而越輕鬆的專案，只要沒被挑問題就會績效非常高。此外，公司並非根據事業群發獎勵金，而是看整體營運去分配，。因此最適合的策略是找核心研發單位，但是又最涼的部門。※發展※。目前體感來說，演算法這個東西對公司來說幾乎不重要，。在這裡程式會極度顯著嚴重退步非常多，不適合未來發展純軟。(隔壁IC Team才可以練功)。程式開發環境極度封閉，公司的電腦無法控制相機，與IT反應了半年後，仍然無法改善。因此個人筆電被公司強制徵用了很久，但同時又被警告說 禁止攜帶個人筆電.。※工時※。每週工時分配如下。30% Coding, 35%做報告 35%開會。※轉型※。嘴上說轉型，但是策略上綁手綁腳，實際上都把責任全部丟給RD，。很多雜事要做，也沒加班費。※結論※。總而言之，在這裡把底薪談高才是王道，然後閃躲飄點滿，其他通通不要期待。",0,1,0,3,1,1,0,0,0,0,0,1,2,0,0,0,0,656,0,1,0,0,0,0,0,0,0,0,0,0,0,0,0,0,0,0,0,0,0,0,0,0,0,0,1,1,3,1,0,0,0,0,2,1,0,10,652
142,廠務工程師,2023.01.12,2023-01,2021.09,兩個部門來找，DDR firmware/TV firmware，兩個都有面到，有二面。印象中要先做英文和性向測驗。第一面跟主管談工作內容和碩論等等，之後一周後等通知來二面，選擇往DDR部門繼續。第二面先跟 HR 談 behavioural 大約一小時，之後跟大主管談，大約再花一個半小時。HR還提醒主管可能比較嚴肅，但實際上還算是滿好聊的，給很多找工作的意見。整個流程到拿 offer 大約三週左右。上一份工作為何離職？個人回答。台灣的部門主要都是在做軟韌體。主要是投爽的，版上心得應該也很多。第一關是線上題目，兩題 Easy，懷疑這真的有鑑別度嗎。之後等一週通知面試。面試是兩次 code interview，考C/C++，。第一次考C，因為我對C不熟，所以寫完對 corner case 就沒有處理得很好，。之後一些C的問題也沒答出來。第二次考C++，這次的題目在面 Google 時有遇過同一個資料結構，所以很快就寫出來。想當然就涼了，有問我對另一個 Wifi team 的意願，但已經收關了就推掉了。,0,0,0,0,0,0,0,0,3,0,0,0,0,0,0,0,0,455,0,0,0,0,0,0,0,0,0,0,0,0,0,0,0,0,0,0,0,0,0,0,0,0,0,0,7,1,0,3,1,0,0,0,0,0,5,1,453
143,研發工程師,2023.01.10,2023-01,2014.08,"先到大廳櫃台說跟某人茲約面試, 被帶去測英文及邏輯測驗, 之後跟主管面試後, 再人資面試, 之後電話通知錄取, 整體花費約兩小時。以下是面試問題。Q1.介紹一下你自己。Q2.你覺得你的缺點是什麼。Q3.你為什麼想離開現在的公司。Q4.你對3~5年的職涯目標規畫如何。Q5.為什麼我們要僱用你?。Q6.分享你遇過最大的挑戰以及你如何因應。A:最大的挑戰就是需要在一個月內的時間送樣給客戶。我需要收集資料並考慮清楚所下的條件是否能達到我的實驗目的。我以我過去所學的知識並在同事的互相協助下完成了那次的送樣。分享你遇過最大的挑戰以及你如何因應？最大的挑戰就是需要在一個月內的時間送樣給客戶。我需要收集資料並考慮清楚所下的條件是否能達到我的實驗目的。我以我過去所學的知識並在同事的互相協助下完成了那次的送樣。建議面試前先上PTT看其他人的面試心得, 平常可以多練習英文聽力, 找親朋好友練習面試口才, 針對面試常問的題目寫好草稿背起來",0,0,0,0,0,0,4,4,1,0,0,0,0,0,0,0,0,414,0,0,0,0,0,0,0,0,0,0,0,0,0,0,0,0,0,0,0,0,0,0,0,0,0,0,9,0,0,0,0,0,0,0,0,1,2,6,413
144,光學工程師,2023.01.09,2023-01,2022.08,首先面試到的是副理，先簡單的自我介紹並且把經歷從大概說一次。副理再依照我提供的資料去詢問問題，大部分都是跟經歷裡面有關的光學問題，。然後副理再介紹出差地點、工作福利條件、工作環境還有薪資等等。之後等了約30分鐘面經理問題與副理大致上都一樣。大學專題光學問題？分享使用如何的光學技巧解決問題。面試過程非常的輕鬆，完全沒有壓力，經理與副理都是非常好的人。所以只要能放輕鬆，基本上沒有什麼問題，不太會刁難。,0,1,0,1,1,0,1,0,0,1,0,1,0,0,0,1,0,201,0,0,0,0,0,0,0,0,0,0,0,0,0,0,0,0,0,0,0,0,0,0,0,0,0,0,4,0,0,2,0,0,0,0,0,0,5,5,195
145,專案實習生,2023.01.09,2023-01,2022.1,起初會收到細心度測驗、職能測驗、英文測驗，細心度就是判讀兩者有無不一樣，職能測驗是有關你最在乎的如：升職機會、員工福利、工作開放程度，英文就是簡短的多益類型題目。會不知道來面試你的主管是甚麼類型的，面試主要流程是先介紹自己製作的專案，但面試官能問的問題有限，不是相關專業的人員，都是先有專案題目才找相關專業的人。專案相關問題？回答專案。公司比較想要找即戰力，不是學習類型的能力，或許有更多相關的專業開發經驗才是最符合公司想要的人，簡單來說媒合很吃運氣。,0,1,0,0,1,0,0,0,1,0,0,0,0,0,0,0,0,227,0,0,0,0,0,0,0,0,0,0,0,0,0,0,0,0,0,0,0,0,0,0,0,0,0,0,3,0,5,1,0,0,0,0,0,5,2,4,225
146,AI工程師,2023.01.06,2023-01,2020.09,一開始先進行筆試，總共分三個，性向測驗、英文測驗及專業測驗，英文考試的難度大概就是跟多益差不多，專業測驗內容涉及範圍較廣，有包含Html、影像處理、AI人工智慧，結束後與小主管面談，過程很愉快，內容有自我介紹、統計方面了解哪些面向、大致講解論文內容，主管介紹部門工作內容很詳細，有問題也都很耐心的回答，過程花費3.5小時，大約一週後接到複試的通知，複試採用視訊面試，主要先自我介紹後，問幾個跟論文有關的問題，之後大主管講解一下工作內容及單位，過程大概40分鐘左右。在大學接觸AI有多少？碩士的時候有上過相關的課程，也有分組進行專題。是否錄取還是較看大主管的想法，如果是新鮮人的話，有專題或是一些相關經驗可以多加準備，大主管會比較有興趣去了解,0,1,0,0,0,0,0,0,6,0,0,0,0,0,0,0,0,321,0,0,0,0,0,0,0,0,0,0,0,0,0,0,0,0,0,0,0,0,0,0,0,0,0,0,6,0,1,2,0,0,1,0,0,3,5,3,320
147,智慧製造工程師,2022.12.28,2022-12,2021.08,面試總共有三個階段。第一階段先和副理級的主管面試，。過程中主要都是以自己準備的PPT做說明，。主管再根據我說明的部分進行提問，。整體給人的感覺不會太差，而且也都對我很客氣；。第二階段則是和經理級的主管面試，。跟第一階段的模式差不多，差別在於第一階段會問比較多技術面的部份，。而第二階段則是比較偏向人格與較廣泛的問題；。最後一階段則是與HR進行談話，。主要也是詢問一些基本的人格問題，。整體面試體驗不差，。能挑毛病的部分大概就是整個過程拉得很長，從一面二面三面到取得Offer總共一個月左右。CPS專案的部分能大概說明一下嗎?？主要是提問我在碩班做的CPS產學合作計畫，其實基本上都是講什麼就被問什麼，。所以準備的資料一定要很熟悉回答得出來。除了講話不要結巴之外，。最主要是自己準備的東西一定要很熟，。不要別人聽完提問之後，反而回答不出來，。這樣感覺很扣分。,0,0,0,0,0,0,0,1,3,0,0,0,1,0,0,0,0,379,0,0,0,0,0,0,0,0,0,0,0,0,0,0,0,0,0,0,0,0,0,0,0,0,0,0,7,0,1,0,0,0,0,0,0,1,5,2,379
148,前端工程師,2022.12.23,2022-12,2019.09,面試總共有三關，。第一關是英文&性向測驗，英文測驗是小型的多益測驗，一樣會有聽讀寫，但是總共只有二十幾題左右，HR 會帶到會議室，架好設備之後就開始測驗，時間到了才會再進來。第二關面了部門主管和PM主管，部門主管有大概介紹了公司的福利，進去之後的工作內容，內容大多是閒聊，沒有問到技術。第三關是處長進來面試，也是閒聊居多，講講之後的規劃。有問到之前和後端工程師合作的方式？照實回答。台北友達只有兩個處有前端，一個處是用 vue，一個用 angular，要看去哪個處，。我進的是用 vue 的那個處，當初進去是唯一的前端，現在算是有兩位會負責前端，。目前產品有使用到的是 vue2+bootstrap4，。主管對於使用的技術或框架不會限制，只要可以解決問題就好，。但是友達生態就是長官出巡的事情蠻多的，要可以適應報告跟 demo 很多,0,1,0,0,1,0,0,1,4,0,0,0,2,0,0,0,0,367,0,0,0,0,0,0,0,0,0,0,0,0,0,0,1,0,0,0,0,0,0,0,0,0,0,0,2,0,0,1,0,0,0,0,0,2,5,2,366
149,作業員,2022.12.21,2022-12,2022.03,"一進去就是先跟警衛哨所交換證件進廠面試。報到後為統一筆試,考細心度及專注度測驗。我覺得題目稍多 不宜寫太久不然會寫不完。交卷後等待主管一一通知面試,通常面試的就是你未來主管。就問一些 有沒有無塵室經驗呀,能不能接受輪班之類的問題。我那時候的專注度測驗題目太多沒回答完所以好像是沒及格。不過主管有讓我重填寫一次就有及格(應該是他想要你才會這樣)。能不能接受夜班？剛好家人有在友達上班 所以夜班剛好是跟家人為A系列的班別。四二輪班別分為四個 DA NA DB NB。我覺得這是一份穩定的工作。不過就是稍嫌枯燥乏味的工作。收入就是不會讓你餓死。但也不太多的工作。還要穿無塵服工作看你們能不能接受了",0,0,0,0,0,4,0,0,3,0,0,1,0,0,0,0,0,296,0,0,0,0,0,0,0,0,0,0,0,0,0,0,0,0,0,0,0,0,0,0,0,0,0,0,4,0,1,4,0,0,0,0,0,0,3,1,294
150,人才發展管理師,2022.12.14,2022-12,2022.08,剛開始是由招募HR電話聯繫，確認基本狀況後，在一個月內展開四次個別視訊面試。每關面試官重視的是面試者思考的迭代方式。就算本科不是人資，他們重視的是在快速變化的時代，是否能就不同領域的背景以不同的方式快速因應目前人才發展的需求。面試官的態度都非常的好。感覺得出來是很重視人才的公司。請分享先前的專案經歷？我自己本身是HR招募專業，但同時對於教育訓練有部分的接觸。所以一直在精進教育訓練的知識。最近一份工作是與海外專案相關的內容。建議先了解一下友達目前的策略目標，可以再面談當中將自己目前能利用的上的部分與公司的策略目標做結合。至少能多幾次面談的機會。,0,2,0,0,0,2,0,0,0,0,1,0,2,0,1,0,0,275,0,0,0,0,0,0,0,0,0,0,0,0,0,0,0,0,0,0,0,0,0,0,0,2,0,0,6,0,2,1,0,0,2,0,1,1,5,0,275
151,工程師,2022.12.12,2022-12,2022.1,面試新竹研發部的工程師，小主管跟大主管都非常友善與客氣。主要詢問大學或研究所做過的專題，並了解你的人格特質。沒有太艱難或刁鑽的問題，整體下來面談的感受很好。友達的環境真的是很不錯，公司很氣派，跟兩個主管各面了一個小時。主要都是一些經典問題，最大挫折、對自己的展望之類的？照實回答。放輕鬆誠實表現自己即可，對於自己大學跟研究所在做什麼很重要。感覺友達是願意帶新人的，面試不要跑錯廠區了,0,0,0,0,0,0,0,0,3,0,0,1,0,0,0,0,0,192,0,0,0,0,0,0,0,0,0,0,0,0,0,0,0,0,0,0,0,0,0,0,0,0,0,0,4,0,0,0,0,0,0,0,0,0,3,8,191
152,廠務工程師,2022.11.26,2022-11,2021.07,因疫情關係是視訊面試，第一關面試跟部門副理，一開始自我介紹後就依照過往工作經歷及論文內容進行問答（面試前建議多順幾次自我介紹內容，並要簡敘之前工作內容及職位等，若沒有工作經驗就多著墨在論文內容的發想及執行等來湊時間），後續長官先詢問是否了解廠務工作內容（儀電、空調、水、氣化的工作內容），後續長官詢問最快上班日期、福利薪資等，以及面試的課別主要工作內容。自我介紹？依個人經歷回答。廠務工作內容？依投的課別（儀電、空調、水及氣化）。氣化課主要內容是穩定提供符合標準的化學品及氣體。面試前先了解主要工作內容，通常能面試且了解主要工作方向都能順利錄取，廠務工程師要團隊合作的解決異常，建議面談時多談到有良好的溝通及團隊合能力。,0,1,0,1,1,0,0,2,0,0,0,0,0,0,0,0,0,311,0,0,0,0,0,2,0,0,0,0,0,0,0,0,0,0,0,0,0,0,0,0,0,0,0,0,10,0,1,9,0,0,0,0,0,3,1,4,311
153,uiux,2022.11.17,2022-11,2022.1,視訊面試，一位leader和其他三位同仁一起面試，leader主要提問，蠻有經驗的專業人士，他們可能要的是很有經驗的UIUX，問得問題簡單，但是也能切中要害，leader會代表其他同仁的問題來做提問。可接受到新竹出差嗎？可。公司內有無UIUX流程？公司沒特別規定正式流程。友達光電面試完，感覺的出來他們的UIUX Team是很專業的，若是能進去應該是不錯的跳板，建議也能嘗試看看。,0,0,0,0,0,0,0,0,0,0,0,0,0,0,0,1,0,191,0,0,0,0,0,0,0,0,0,0,0,0,0,0,0,0,0,0,0,0,0,0,0,0,0,0,4,0,2,0,0,0,0,0,0,2,0,2,191
154,儲能系統專案業務,2022.10.28,2022-10,2022.09,友達新創部門，主要是做儲能系統的，因要尋找有工程背景又對儲能機電方面的人不容易，所以在找有工程背景的人來培養，成為業務。薪資條件：說是不會管你寫的希望待遇，會由主管討論出覺得可以給你多少就是多少，即使比希望待遇少，要調整空間有大概3-5%左右。整體面試花費了4小時，從部門主管、部門經理到單位副總，還從本廠跑去2廠面試⋯⋯公司環境看起來不錯。業務層面問題？問了很多關於自我挑戰，還有業務層面，遇到刁鑽客戶該怎麼處理等等情境題，還問了很多關於本人目前就職的專業，替公司爭取到或是做到什麼具體影響。整體而言詢問的東西都偏向如何解決客戶問題，自我提升，等等問題（業務職缺），有提到部門不一定會有教育訓練，且因為需要人，可能會有趕鴨子上架的情況，給你學習的時間不會太多，建議有機電相關經驗的人較適合！,0,2,0,3,0,1,1,0,2,0,0,1,0,0,0,0,0,347,0,0,0,0,0,0,0,0,0,0,0,1,0,0,0,0,0,0,0,2,0,0,0,1,0,0,2,1,1,0,0,0,0,0,0,1,2,5,345
155,EE,2022.10.24,2022-10,2020.08,面試會由副理先來面試，請你做簡單的自我介紹，闡訴自己大學的得獎專題、研究所的論文、分享遊學和課外參加活動…等等。沒有什麼太多專業的問答，頂多針對自己專題及論文做一次詳細的報告，且詢問在這段期是否有遇到挫折的事情，怎麼解決。再來就換經理面試，說進來可以在學，薪水在竹科算pr75，薪水給的還不錯，不然竹科過個馬路就可以跳巢，希望可以留住人才。最後，HR電話通知錄取，給予電子offer。大學專題、研究所論文？如實回答。剛出社會的新鮮人可以進來練功當跳板，是一個很好學習的環境，但學習曲線算比較緩和，有好有壞，看自己怎麼想。,0,2,0,2,0,0,0,0,0,0,0,1,0,0,0,0,0,261,0,0,0,0,0,0,0,0,0,0,0,0,0,0,0,0,0,0,1,0,0,0,0,0,0,0,6,0,0,0,0,0,2,0,0,1,2,4,262
156,職員,2023.03.10,2023-03,2019.04,先由人資帶進辦公室，辦公室環境還蠻乾淨的，另一邊可以直達工廠生產線，外面會有很多貨櫃。主要由應徵單位主管面試，簡單的問答了不了解自行車產業，也會簡單講解公司集團之間的關係，時間半小時至一小時，氣氛算是輕鬆。為什麼離職？生涯規劃。如果有相關自行車經驗加分，英文能力（包含口說能力）好也很加分，有自信敢表達很重要。整體做好準備就不太會有問題,0,0,0,0,0,0,0,0,1,0,0,2,0,0,0,0,0,169,0,0,0,0,0,0,0,0,0,0,0,0,0,0,0,0,0,0,0,0,0,0,0,0,0,0,1,1,1,0,1,0,0,0,0,2,2,6,168
157,韌體,2023.02.16,2023-02,2023.02,人資先面試，詢問罐頭面試題，遇到的困難為何？何事最具成就感？論文的內容與實作的經驗為何？主管也是詢問類似的問題，但主要強調實作的部分，並且一直說自己是global 的共公司，所以要學的東西很多，可能RD兼PM。薪水範圍？N*13.5+分紅約為16，但底薪不高。有愛再來這間公司吧，不然薪水真的是偏少，然後職務需要最很多與自身無關的事，需要十項全能的工具人，對腳踏車有愛的話歡迎加入,1,0,0,4,1,0,0,0,1,0,0,0,0,0,0,0,0,191,0,0,0,0,0,0,0,0,0,0,0,0,0,0,0,0,0,0,0,0,0,0,0,0,0,0,2,1,1,0,0,0,0,0,0,0,2,2,189
158,國外業務管理師,2023.02.05,2023-02,2021.09,由人資先進行電話面談，簡單用英文自我介紹約3分鐘，後續由主管親自面談。主管面談過程約分為自我介紹、動機了解、想問的問題，建議自帶履歷，可以提供給主管參考，當時先針對過去的經歷做介紹，也分享了為何想要應徵此公司的動機，最後可以再針對產業的動態詢問公司未來的發展藍圖或是策略走向等。有沒有應徵同產業的其他公司？據實回答即可，我當時回答沒有，可以簡短說明為什麼。smart casual參加面試即可，主管親切，能夠像朋友般跟你聊天，我當時原本很緊張，後來越聊越開心，也可以跟主管分享自己的職涯規劃、對工作的期許等。,0,0,0,0,0,0,0,0,6,0,0,0,1,0,0,0,0,255,0,0,0,0,0,0,0,0,0,0,0,0,0,0,0,0,0,0,0,0,0,0,0,0,0,0,3,2,0,1,0,0,0,0,1,0,6,4,254
159,產線作業員,2023.01.25,2023-01,2020.02,一整年都在缺人的 面試就寫履歷 看作業環境(影片) 跟小學生的那種數學題ex:10X10=?。面試官算很好相處那種 面試過程不會有壓力 都固定中午前 可以直接到公司大樓面試 需要同意每天加班至少2H 跟配合禮拜6加班8H 含全勤36K~38K 環境就是熱 主管都是靠巴結或靠關係的那種 看你不爽就亂調職 有的禮拜天還要來上班 外勞都會逃逸的工廠。上一份工作離職原因？產業沒落 放無薪假。最好是別來浪費生命了  操得要死 海線居民都知道這間 出了名的 血汗工廠 也有過外勞因為過於勞累直接死在機台前的 暴斃那種 每天加班  有關係或會巴結的 跟米蟲一樣 沒有的都是操到死,0,0,0,0,0,3,1,0,1,0,0,2,0,0,0,0,0,285,0,0,0,0,0,0,0,0,0,0,0,0,0,0,0,0,0,0,0,0,0,0,0,0,0,0,5,0,0,1,1,0,0,0,0,1,2,2,289
160,調度人員,2022.12.08,2022-12,2016.08,公司比較偏體力活，獎金依照績效達標會比例發放，需要早上晚上輪班，需要開小貨車，將腳踏車台上貨車上，一個月有一定數量要達成，負責區域不能有太多空爆站，現場協助民眾註冊以及協尋遺失物，或是遺失車部分都是工作職責內。住那裡？樹林。只要有心其實都可以來應徵，工作不難就是需要體力，如果是過渡期可以先來做做，如果是馬上有薪水也可以來這邊做,0,0,0,1,1,1,0,1,0,0,0,0,0,0,0,0,0,165,0,0,0,0,0,0,0,0,0,0,0,0,0,0,0,0,0,0,0,0,0,0,0,0,0,0,0,1,0,2,0,0,0,0,0,0,0,1,165
161,正職門市人員,2022.12.06,2022-12,2022.12,面試是在淡水家樂福裡面，首先自我介紹，店長開始會介紹環境、公司福利制度，會有業績獎金，以及考取到證照每個月也會有加錢，由於是在大型賣場裡面，所以客人非常多，也解釋到要對腳踏車專業知識度要加強，感覺沒有專屬的辦公室。有沒有在運動?？照實回答。為什麼會來應徵我們公司?？因為自己有在運動，對運動產業有興趣，想要增加在這方面的專業知識。面試過程很簡單，基本上照實回答就好，但他們很強調運動，所以可能會問你運動方面的問題，差不多就是這樣!,0,0,0,0,2,1,0,0,0,0,0,1,0,0,0,0,0,216,0,0,0,0,0,0,0,0,0,0,0,0,0,0,1,0,0,0,0,0,0,0,0,0,0,0,2,1,0,0,0,0,0,0,0,2,0,5,216
